{
  "$schema": "../../../../../schemas/docs-mcp.schema.json",
  "version": "1",
  "strategy": {
    "chunk_by": "h2",
    "max_chunk_size": 8000,
    "min_chunk_size": 200
  },
  "metadata": {
    "scope": "sdk-specific",
    "language": "python"
  },
  "taxonomy": {
    "language": {
      "vector_collapse": true,
      "properties": {
        "python": {
          "mcp_resource": true
        }
      }
    }
  }
}
